<?xml version="1.0" encoding="utf-8"?>
<!-- This file is used for xml files which install or update package installation plugins. -->
<xs:schema id="data" targetNamespace="http://www.woltlab.com" xmlns="http://www.woltlab.com" xmlns:xs="http://www.w3.org/2001/XMLSchema" attributeFormDefault="qualified" elementFormDefault="qualified">
	<xs:element name="data">
		<xs:complexType>
			<xs:choice minOccurs="0" maxOccurs="unbounded">
				<xs:element name="import">
					<xs:complexType>
						<xs:sequence>
							<xs:element name="pip" nillable="true" minOccurs="0" maxOccurs="unbounded">
								<xs:complexType>
									<xs:simpleContent>
										<xs:extension base="xs:string">
											<xs:attribute name="name" form="unqualified" type="xs:string" />
										</xs:extension>
									</xs:simpleContent>
								</xs:complexType>
							</xs:element>
						</xs:sequence>
					</xs:complexType>
				</xs:element>
			</xs:choice>
		</xs:complexType>
	</xs:element>
</xs:schema>